{
  "schema_version": 1,
  "source": {"reference": "team-policy.md", "authority": "accepted"},
  "repository": {"id": "example-service", "project_type": "api", "stack": null},
  "integrations": {"agent": "codex", "ci": "github"},
  "capabilities": [{"id": "application-governance"}, {"id": "llm-evaluation"}],
  "policy": {
    "source": {"reference": "team-policy.md", "authority": "accepted"},
    "required_capabilities": ["application-governance"],
    "required_checks": [{"id": "llm-exact-match", "capability_id": "llm-evaluation"}]
  }
}
